{
    "manufacturer": "smartprocess",
    "model": "smartrail-x835",
    "description": "",
    "version": "",
    "url": "https://www.aggsoft.com/serial-data-logger/tutorials/modbus-data-logging/smartprocess-smartrail-x835.htm",
    "tags": {
        "industry": "Unknown",
        "application": "Unknown"
    }
}