{
    "manufacturer": "lovato",
    "model": "electric-rgk800",
    "description": "",
    "version": "",
    "url": "https://www.aggsoft.com/serial-data-logger/tutorials/modbus-data-logging/lovato-electric-rgk800.htm",
    "tags": {
        "industry": "Unknown",
        "application": "Unknown"
    }
}