{
    "manufacturer": "solarx",
    "model": "power-hybrid-x1-hybrid-x3-x1ac",
    "description": "",
    "version": "",
    "url": "https://www.aggsoft.com/serial-data-logger/tutorials/modbus-data-logging/solarx-power-hybrid-x1-hybrid-x3-x1ac.htm",
    "tags": {
        "industry": "Unknown",
        "application": "Unknown"
    }
}