{
    "manufacturer": "kael",
    "model": "multiser-01-multiser-11-multiser-13",
    "description": "",
    "version": "",
    "url": "https://www.aggsoft.com/serial-data-logger/tutorials/modbus-data-logging/kael-multiser-01-multiser-11-multiser-13.htm",
    "tags": {
        "industry": "Unknown",
        "application": "Unknown"
    }
}