{
    "manufacturer": "schneider",
    "model": "electric-pm5500",
    "description": "",
    "version": "",
    "url": "https://www.aggsoft.com/serial-data-logger/tutorials/modbus-data-logging/schneider-electric-pm5500.htm",
    "tags": {
        "industry": "Unknown",
        "application": "Unknown"
    }
}