{
    "manufacturer": "kael",
    "model": "varkombi-18-pc-tft",
    "description": "",
    "version": "",
    "url": "https://www.aggsoft.com/serial-data-logger/tutorials/modbus-data-logging/kael-varkombi-18-pc-tft.htm",
    "tags": {
        "industry": "Unknown",
        "application": "Unknown"
    }
}