{
    "manufacturer": "schneider",
    "model": "electric-em1000-em1100-em1200",
    "description": "",
    "version": "",
    "url": "https://www.aggsoft.com/serial-data-logger/tutorials/modbus-data-logging/schneider-electric-em1000-em1100-em1200.htm",
    "tags": {
        "industry": "Unknown",
        "application": "Unknown"
    }
}