{
    "manufacturer": "jiangsu",
    "model": "sfere-electric-sfere-720",
    "description": "",
    "version": "",
    "url": "https://www.aggsoft.com/serial-data-logger/tutorials/modbus-data-logging/jiangsu-sfere-electric-sfere-720.htm",
    "tags": {
        "industry": "Unknown",
        "application": "Unknown"
    }
}