{
    "manufacturer": "inepro",
    "model": "metering-pro380",
    "description": "",
    "version": "",
    "url": "https://www.aggsoft.com/serial-data-logger/tutorials/modbus-data-logging/inepro-metering-pro380.htm",
    "tags": {
        "industry": "Unknown",
        "application": "Unknown"
    }
}