{
    "manufacturer": "secure",
    "model": "elite-103-elite-303-elite-307",
    "description": "",
    "version": "",
    "url": "https://www.aggsoft.com/serial-data-logger/tutorials/modbus-data-logging/secure-elite-103-elite-303-elite-307.htm",
    "tags": {
        "industry": "Unknown",
        "application": "Unknown"
    }
}