{
    "manufacturer": "siemens",
    "model": "sem3-single-phase",
    "description": "",
    "version": "",
    "url": "https://www.aggsoft.com/serial-data-logger/tutorials/modbus-data-logging/siemens-sem3-single-phase.htm",
    "tags": {
        "industry": "Energy",
        "application": "Energy Metering"
    }
}