{
    "manufacturer": "rayleigh",
    "model": "instruments-ri-f200",
    "description": "",
    "version": "",
    "url": "https://www.aggsoft.com/serial-data-logger/tutorials/modbus-data-logging/rayleigh-instruments-ri-f200.htm",
    "tags": {
        "industry": "Unknown",
        "application": "Unknown"
    }
}