{
    "manufacturer": "northern",
    "model": "design-multicube-modbus",
    "description": "",
    "version": "",
    "url": "https://www.aggsoft.com/serial-data-logger/tutorials/modbus-data-logging/northern-design-multicube-modbus.htm",
    "tags": {
        "industry": "Unknown",
        "application": "Unknown"
    }
}