{
    "manufacturer": "lifasa",
    "model": "master-control-var",
    "description": "",
    "version": "",
    "url": "https://www.aggsoft.com/serial-data-logger/tutorials/modbus-data-logging/lifasa-master-control-var.htm",
    "tags": {
        "industry": "Unknown",
        "application": "Unknown"
    }
}