{
    "manufacturer": "electro",
    "model": "industries-shark-250",
    "description": "",
    "version": "",
    "url": "https://www.aggsoft.com/serial-data-logger/tutorials/modbus-data-logging/electro-industries-shark-250.htm",
    "tags": {
        "industry": "Unknown",
        "application": "Unknown"
    }
}