{
    "manufacturer": "socomec",
    "model": "netys-pr-netys-rt-itys",
    "description": "",
    "version": "",
    "url": "https://www.aggsoft.com/serial-data-logger/tutorials/modbus-data-logging/socomec-netys-pr-netys-rt-itys.htm",
    "tags": {
        "industry": "Unknown",
        "application": "Unknown"
    }
}