{
    "manufacturer": "hager",
    "model": "ecn-ecp-ect-ecm-ecr-eca",
    "description": "",
    "version": "",
    "url": "https://www.aggsoft.com/serial-data-logger/tutorials/modbus-data-logging/hager-ecn-ecp-ect-ecm-ecr-eca.htm",
    "tags": {
        "industry": "Unknown",
        "application": "Unknown"
    }
}