{
    "manufacturer": "power",
    "model": "one-inverter-pvi-aurora-central",
    "description": "",
    "version": "",
    "url": "https://www.aggsoft.com/serial-data-logger/tutorials/modbus-data-logging/power-one-inverter-pvi-aurora-central.htm",
    "tags": {
        "industry": "Unknown",
        "application": "Unknown"
    }
}